{
  "schema": "appliance.crossings.v1",
  "profile": "homesi",
  "bands": [
    "local-ai/card",
    "local-ai/library",
    "local-ai/slot",
    "appliance/harmonia-press",
    "appliance/journal-vacuum",
    "appliance/service",
    "appliance/sudo-passwordless",
    "exousia/bind",
    "exousia/change",
    "exousia/reset-default",
    "exousia/verify",
    "face/app",
    "face/badge",
    "face/bar",
    "face/dictate",
    "face/fetch",
    "face/focus",
    "face/launch",
    "face/launcher-cache",
    "face/screenshot",
    "face/volume",
    "face/workspace",
    "network/cert/house-ca",
    "network/cert/refresh",
    "network/child-device",
    "network/dhcp",
    "network/dns",
    "network/firewall",
    "network/identity",
    "network/linker",
    "network/wake-on-lan",
    "network/wifi",
    "settings/appearance",
    "settings/datetime",
    "settings/datetime/household-time",
    "settings/default-apps",
    "settings/display",
    "settings/energy",
    "settings/input",
    "settings/keyboard",
    "settings/notifications",
    "settings/region",
    "settings/samba",
    "settings/sound",
    "settings/ssh",
    "storage/backup/forgejo/credential",
    "storage/disk/test",
    "storage/upload/force-permissions",
    "storage/upload/ingress",
    "storage/vault/open",
    "storage/vault/policy",
    "update/service",
    "update/sources-reseed"
  ],
  "verbs": [
    ["local-ai", "card"],
    ["local-ai", "library"],
    ["local-ai", "slot"],
    ["cert", "house-ca"],
    ["exousia", "bind"],
    ["exousia", "change"],
    ["exousia", "reset-default"],
    ["exousia", "verify"],
    ["face", "app"],
    ["face", "badge"],
    ["face", "bar"],
    ["face", "dictate"],
    ["face", "fetch"],
    ["face", "focus"],
    ["face", "launch"],
    ["face", "launcher-cache"],
    ["face", "screenshot"],
    ["face", "volume"],
    ["face", "workspace"],
    ["network", "child-device"],
    ["network", "dhcp"],
    ["network", "dns"],
    ["network", "firewall"],
    ["network", "identity"],
    ["network", "linker"],
    ["network", "wake-on-lan"],
    ["settings", "appearance"],
    ["settings", "datetime"],
    ["settings", "default-apps"],
    ["settings", "display"],
    ["settings", "energy"],
    ["settings", "input"],
    ["settings", "keyboard"],
    ["settings", "notifications"],
    ["settings", "region"],
    ["settings", "samba"],
    ["settings", "sound"],
    ["settings", "ssh"],
    ["time", "household-time"],
    ["update", "service"],
    ["update", "sources-reseed"],
    ["upload", "force-permissions"],
    ["upload", "ingress"],
    ["vault", "open"]
  ],
  "routes": [
    "/api/v1/local-ai/card",
    "/api/v1/local-ai/library",
    "/api/v1/local-ai/slot/brain",
    "/api/v1/local-ai/slot/embed",
    "/api/v1/local-ai/slot/ear",
    "/api/v1/access/sudo/mode",
    "/api/v1/cert/bundle/download",
    "/api/v1/cert/status",
    "/api/v1/cert/trust-fetch",
    "/api/v1/cert/trust-install",
    "/api/v1/face/app",
    "/api/v1/face/badge",
    "/api/v1/face/bar",
    "/api/v1/face/dictate",
    "/api/v1/face/fetch",
    "/api/v1/face/focus",
    "/api/v1/face/launch",
    "/api/v1/face/launcher-cache",
    "/api/v1/face/meter",
    "/api/v1/face/screenshot",
    "/api/v1/face/volume",
    "/api/v1/face/workspace",
    "/api/v1/file/ingress",
    "/api/v1/file/ingress/:upload_id/complete",
    "/api/v1/interactables",
    "/api/v1/interactables/:id/run",
    "/api/v1/network/device",
    "/api/v1/network/device/connect",
    "/api/v1/network/device/disconnect",
    "/api/v1/network/device/ipv4",
    "/api/v1/network/device/wake",
    "/api/v1/network/device/wifi/connect",
    "/api/v1/network/device/wifi/disconnect",
    "/api/v1/network/device/wifi/forget",
    "/api/v1/network/device/wifi/ipv4",
    "/api/v1/network/device/wifi/radio",
    "/api/v1/network/dhcp/reservations",
    "/api/v1/network/dns/read",
    "/api/v1/network/dns/resolver/status",
    "/api/v1/network/dns/status",
    "/api/v1/network/status",
    "/api/v1/settings/appearance",
    "/api/v1/settings/child-device",
    "/api/v1/settings/datetime",
    "/api/v1/settings/default-apps",
    "/api/v1/settings/display",
    "/api/v1/settings/energy",
    "/api/v1/settings/input",
    "/api/v1/settings/keyboard",
    "/api/v1/settings/notifications",
    "/api/v1/settings/region",
    "/api/v1/settings/samba/status",
    "/api/v1/settings/sound",
    "/api/v1/settings/ssh/status",
    "/api/v1/storage/vault/auto-decrypt",
    "/api/v1/storage/vault/unlock",
    "/api/v1/sync/now",
    "/api/v1/update/check",
    "/api/v1/update/now",
    "/api/v1/update/service/status",
    "/api/v1/update/service/toggle",
    "/api/v1/upload/force-permissions"
  ],
  "administrative": {
    "bands": [
      "local-ai/slot",
      "appliance/service",
      "appliance/sudo-passwordless",
      "settings/datetime",
      "settings/input",
      "storage/vault/open",
      "storage/vault/policy"
    ],
    "verbs": [
      ["local-ai", "slot"],
      ["exousia", "change"],
      ["exousia", "reset-default"],
      ["settings", "appearance"],
      ["settings", "datetime"],
      ["settings", "default-apps"],
      ["settings", "display"],
      ["settings", "notifications"],
      ["settings", "sound"]
    ],
    "routes": [
      "PUT /api/v1/local-ai/slot/brain",
      "PUT /api/v1/local-ai/slot/embed",
      "PUT /api/v1/local-ai/slot/ear",
      "/api/v1/access/sudo/mode",
      "/api/v1/settings/appearance",
      "/api/v1/settings/datetime",
      "/api/v1/settings/default-apps",
      "/api/v1/settings/display",
      "/api/v1/settings/input",
      "/api/v1/settings/notifications",
      "/api/v1/settings/sound",
      "/api/v1/storage/vault/auto-decrypt"
    ]
  }
}
