{
  "schema": "appliance.crossings.v1",
  "profile": "homeconsole",
  "bands": [
    "appliance/harmonia-press",
    "appliance/journal-vacuum",
    "appliance/service",
    "appliance/sudo-passwordless",
    "console/restart",
    "exousia/bind",
    "exousia/change",
    "exousia/reset-default",
    "exousia/verify",
    "games/provider-keys",
    "games/sync",
    "gui/update",
    "network/cert/house-ca",
    "network/cert/refresh",
    "network/child-device",
    "network/dhcp",
    "network/dns",
    "network/firewall",
    "network/identity",
    "network/linker",
    "network/wake-on-lan",
    "network/wifi",
    "settings/appearance",
    "settings/datetime",
    "settings/default-apps",
    "settings/display",
    "settings/input",
    "settings/notifications",
    "settings/sound",
    "storage/backup/forgejo/credential",
    "storage/disk/test",
    "storage/upload/force-permissions",
    "storage/upload/ingress",
    "storage/vault/open",
    "storage/vault/policy",
    "update/service",
    "update/sources-reseed"
  ],
  "verbs": [
    [
      "cert",
      "house-ca"
    ],
    [
      "console",
      "restart"
    ],
    [
      "exousia",
      "bind"
    ],
    [
      "exousia",
      "change"
    ],
    [
      "exousia",
      "reset-default"
    ],
    [
      "exousia",
      "verify"
    ],
    [
      "gui",
      "update"
    ],
    [
      "network",
      "child-device"
    ],
    [
      "network",
      "dhcp"
    ],
    [
      "network",
      "dns"
    ],
    [
      "network",
      "firewall"
    ],
    [
      "network",
      "identity"
    ],
    [
      "network",
      "linker"
    ],
    [
      "network",
      "wake-on-lan"
    ],
    [
      "settings",
      "appearance"
    ],
    [
      "settings",
      "datetime"
    ],
    [
      "settings",
      "default-apps"
    ],
    [
      "settings",
      "display"
    ],
    [
      "settings",
      "input"
    ],
    [
      "settings",
      "notifications"
    ],
    [
      "settings",
      "sound"
    ],
    [
      "update",
      "service"
    ],
    [
      "update",
      "sources-reseed"
    ],
    [
      "upload",
      "force-permissions"
    ],
    [
      "upload",
      "ingress"
    ],
    [
      "vault",
      "open"
    ]
  ],
  "routes": [
    "/api/v1/access/sudo/mode",
    "/api/v1/cert/bundle/download",
    "/api/v1/cert/status",
    "/api/v1/cert/trust-fetch",
    "/api/v1/cert/trust-install",
    "/api/v1/console/restart",
    "/api/v1/file/ingress",
    "/api/v1/file/ingress/:upload_id/complete",
    "/api/v1/games/provider-keys",
    "/api/v1/games/sync",
    "/api/v1/gaming/provider-keys",
    "/api/v1/gaming/sync",
    "/api/v1/gui/update/now",
    "/api/v1/interactables",
    "/api/v1/interactables/:id/run",
    "/api/v1/network/device",
    "/api/v1/network/device/claim",
    "/api/v1/network/device/wake",
    "/api/v1/network/device/wifi/connect",
    "/api/v1/network/device/wifi/disconnect",
    "/api/v1/network/device/wifi/forget",
    "/api/v1/network/device/wifi/ipv4",
    "/api/v1/network/device/wifi/radio",
    "/api/v1/network/dns",
    "/api/v1/network/dns/adblock",
    "/api/v1/network/dns/alias/create",
    "/api/v1/network/dns/alias/remove",
    "/api/v1/network/dns/blocklist/update",
    "/api/v1/network/dns/device-name/create",
    "/api/v1/network/dns/device-name/remove",
    "/api/v1/network/dns/read",
    "/api/v1/network/dns/resolver/status",
    "/api/v1/network/dns/status",
    "/api/v1/network/dns/upstream",
    "/api/v1/network/firewall/children",
    "/api/v1/network/firewall/children/:mac",
    "/api/v1/network/firewall/children/:mac/whitelist",
    "/api/v1/network/status",
    "/api/v1/settings/appearance",
    "/api/v1/settings/child-device",
    "/api/v1/settings/datetime",
    "/api/v1/settings/default-apps",
    "/api/v1/settings/display",
    "/api/v1/settings/input",
    "/api/v1/settings/notifications",
    "/api/v1/settings/sound",
    "/api/v1/storage/vault/unlock",
    "/api/v1/sync/now",
    "/api/v1/update/check",
    "/api/v1/update/now",
    "/api/v1/update/service/status",
    "/api/v1/update/service/toggle",
    "/api/v1/upload/force-permissions"
  ],
  "administrative": {
    "bands": [
      "appliance/service",
      "appliance/sudo-passwordless",
      "network/dns",
      "settings/datetime",
      "settings/input",
      "storage/vault/open",
      "storage/vault/policy"
    ],
    "verbs": [
      [
        "exousia",
        "change"
      ],
      [
        "exousia",
        "reset-default"
      ],
      [
        "settings",
        "appearance"
      ],
      [
        "settings",
        "default-apps"
      ],
      [
        "settings",
        "datetime"
      ],
      [
        "settings",
        "display"
      ],
      [
        "settings",
        "notifications"
      ],
      [
        "settings",
        "sound"
      ]
    ],
    "routes": [
      "/api/v1/access/sudo/mode",
      "/api/v1/network/dns",
      "/api/v1/network/dns/adblock",
      "/api/v1/network/dns/alias/create",
      "/api/v1/network/dns/alias/remove",
      "/api/v1/network/dns/blocklist/update",
      "/api/v1/network/dns/device-name/create",
      "/api/v1/network/dns/device-name/remove",
      "/api/v1/network/dns/upstream",
      "/api/v1/settings/appearance",
      "/api/v1/settings/datetime",
      "/api/v1/settings/default-apps",
      "/api/v1/settings/display",
      "/api/v1/settings/input",
      "/api/v1/settings/notifications",
      "/api/v1/settings/sound",
      "/api/v1/storage/vault/auto-decrypt"
    ]
  }
}
