{
  "schema": "appliance.crossings.v1",
  "profile": "tv",
  "bands": [
    "appliance/harmonia-press",
    "appliance/journal-vacuum",
    "appliance/service",
    "appliance/sudo-passwordless",
    "console/steam-install",
    "exousia/bind",
    "exousia/change",
    "exousia/reset-default",
    "exousia/verify",
    "face/app",
    "face/badge",
    "face/bar",
    "face/dictate",
    "face/fetch",
    "face/focus",
    "face/workspace",
    "face/launch",
    "face/launcher-cache",
    "face/meter",
    "face/screenshot",
    "face/volume",
    "gui/update",
    "network/cert/house-ca",
    "network/cert/refresh",
    "network/child-device",
    "network/dhcp",
    "network/dns",
    "network/firewall",
    "network/identity",
    "network/linker",
    "network/wake-on-lan",
    "network/wifi",
    "settings/appearance",
    "settings/datetime",
    "settings/datetime/household-time",
    "settings/default-apps",
    "settings/display",
    "settings/input",
    "settings/notifications",
    "settings/sound",
    "settings/ssh",
    "storage/backup/forgejo/credential",
    "storage/disk/test",
    "storage/upload/force-permissions",
    "storage/upload/ingress",
    "storage/vault/open",
    "storage/vault/policy",
    "update/service",
    "update/sources-reseed"
  ],
  "verbs": [
    [
      "cert",
      "house-ca"
    ],
    [
      "console",
      "steam-install"
    ],
    [
      "exousia",
      "bind"
    ],
    [
      "exousia",
      "change"
    ],
    [
      "exousia",
      "reset-default"
    ],
    [
      "exousia",
      "verify"
    ],
    [
      "face",
      "app"
    ],
    [
      "face",
      "badge"
    ],
    [
      "face",
      "bar"
    ],
    [
      "face",
      "dictate"
    ],
    [
      "face",
      "fetch"
    ],
    [
      "face",
      "focus"
    ],
    [
      "face",
      "workspace"
    ],
    [
      "face",
      "launch"
    ],
    [
      "face",
      "launcher-cache"
    ],
    [
      "face",
      "meter"
    ],
    [
      "face",
      "screenshot"
    ],
    [
      "face",
      "volume"
    ],
    [
      "gui",
      "update"
    ],
    [
      "network",
      "child-device"
    ],
    [
      "network",
      "dhcp"
    ],
    [
      "network",
      "dns"
    ],
    [
      "network",
      "firewall"
    ],
    [
      "network",
      "identity"
    ],
    [
      "network",
      "linker"
    ],
    [
      "network",
      "wake-on-lan"
    ],
    [
      "settings",
      "appearance"
    ],
    [
      "settings",
      "datetime"
    ],
    [
      "settings",
      "default-apps"
    ],
    [
      "settings",
      "display"
    ],
    [
      "settings",
      "input"
    ],
    [
      "settings",
      "notifications"
    ],
    [
      "settings",
      "sound"
    ],
    [
      "settings",
      "ssh"
    ],
    [
      "time",
      "household-time"
    ],
    [
      "update",
      "service"
    ],
    [
      "update",
      "sources-reseed"
    ],
    [
      "upload",
      "force-permissions"
    ],
    [
      "upload",
      "ingress"
    ],
    [
      "vault",
      "open"
    ]
  ],
  "routes": [
    "/api/v1/access/sudo/mode",
    "/api/v1/cert/bundle/download",
    "/api/v1/cert/status",
    "/api/v1/cert/trust-fetch",
    "/api/v1/cert/trust-install",
    "/api/v1/console/steam",
    "/api/v1/console/steam/install",
    "/api/v1/face/app",
    "/api/v1/face/badge",
    "/api/v1/face/bar",
    "/api/v1/face/dictate",
    "/api/v1/face/fetch",
    "/api/v1/face/focus",
    "/api/v1/face/workspace",
    "/api/v1/face/launch",
    "/api/v1/face/launcher-cache",
    "/api/v1/face/meter",
    "/api/v1/face/screenshot",
    "/api/v1/face/volume",
    "/api/v1/file/ingress",
    "/api/v1/file/ingress/:upload_id/complete",
    "/api/v1/gui/update/now",
    "/api/v1/interactables",
    "/api/v1/interactables/:id/run",
    "/api/v1/network/device",
    "/api/v1/network/device/claim",
    "/api/v1/network/device/wake",
    "/api/v1/network/device/wifi/connect",
    "/api/v1/network/device/wifi/disconnect",
    "/api/v1/network/device/wifi/forget",
    "/api/v1/network/device/wifi/ipv4",
    "/api/v1/network/device/wifi/radio",
    "/api/v1/network/dhcp",
    "/api/v1/network/dhcp/pool-boundary",
    "/api/v1/network/dhcp/reservations",
    "/api/v1/network/dhcp/reservations/:reservation_id",
    "/api/v1/network/dns",
    "/api/v1/network/dns/adblock",
    "/api/v1/network/dns/alias/create",
    "/api/v1/network/dns/alias/remove",
    "/api/v1/network/dns/blocklist/update",
    "/api/v1/network/dns/device-name/create",
    "/api/v1/network/dns/device-name/remove",
    "/api/v1/network/dns/read",
    "/api/v1/network/dns/resolver/status",
    "/api/v1/network/dns/status",
    "/api/v1/network/dns/upstream",
    "/api/v1/network/firewall/children",
    "/api/v1/network/firewall/children/:mac",
    "/api/v1/network/firewall/children/:mac/whitelist",
    "/api/v1/network/status",
    "/api/v1/settings/appearance",
    "/api/v1/settings/child-device",
    "/api/v1/settings/datetime",
    "/api/v1/settings/default-apps",
    "/api/v1/settings/display",
    "/api/v1/settings/input",
    "/api/v1/settings/notifications",
    "/api/v1/settings/sound",
    "/api/v1/settings/ssh/status",
    "/api/v1/storage/vault/auto-decrypt",
    "/api/v1/storage/vault/unlock",
    "/api/v1/sync/now",
    "/api/v1/update/check",
    "/api/v1/update/now",
    "/api/v1/update/service/status",
    "/api/v1/update/service/toggle",
    "/api/v1/upload/force-permissions"
  ],
  "administrative": {
    "bands": [
      "appliance/service",
      "appliance/sudo-passwordless",
      "network/dns",
      "settings/datetime",
      "settings/input",
      "storage/vault/open",
      "storage/vault/policy"
    ],
    "verbs": [
      [
        "exousia",
        "change"
      ],
      [
        "exousia",
        "reset-default"
      ],
      [
        "settings",
        "appearance"
      ],
      [
        "settings",
        "default-apps"
      ],
      [
        "settings",
        "datetime"
      ],
      [
        "settings",
        "display"
      ],
      [
        "settings",
        "notifications"
      ],
      [
        "settings",
        "sound"
      ]
    ],
    "routes": [
      "POST /api/v1/console/steam/install",
      "/api/v1/access/sudo/mode",
      "/api/v1/network/dhcp",
      "/api/v1/network/dhcp/pool-boundary",
      "/api/v1/network/dhcp/reservations",
      "/api/v1/network/dhcp/reservations/:reservation_id",
      "/api/v1/network/dns",
      "/api/v1/network/dns/adblock",
      "/api/v1/network/dns/alias/create",
      "/api/v1/network/dns/alias/remove",
      "/api/v1/network/dns/blocklist/update",
      "/api/v1/network/dns/device-name/create",
      "/api/v1/network/dns/device-name/remove",
      "/api/v1/network/dns/upstream",
      "/api/v1/settings/appearance",
      "/api/v1/settings/datetime",
      "/api/v1/settings/default-apps",
      "/api/v1/settings/display",
      "/api/v1/settings/input",
      "/api/v1/settings/notifications",
      "/api/v1/settings/sound",
      "/api/v1/storage/vault/auto-decrypt",
      "/api/v1/storage/vault/unlock"
    ]
  }
}
